{"schema":"spatial-proteomics-bundle","schema_version":"1.0.0","dataset":{"id":"synthetic-beta","title":"Synthetic spatial map, Fictus alter","description":"Synthetic data generated for software tests. Not a biological result.","organism":{"name":"Fictus alter","taxon_id":null,"condition":"synthetic"},"citation":{"text":"Synthetic fixture, spatialprot test suite. No publication.","peer_reviewed":false},"license":{"id":"CC0-1.0","name":"Creative Commons Zero 1.0","url":"https://creativecommons.org/publicdomain/zero/1.0/","redistribution":"permitted"},"attribution":"Generated by spatial/tests/fixtures/make_fixtures.py.","provenance":{"builder":"make_fixtures.py","built":"2026-10-09","sources":[{"name":"make_fixtures.py","description":"Seeded pseudo-random generator; no experimental input."}],"steps":["Draw a compartment per protein group.","Draw a profile around that compartment's template.","Derive the example layers from the drawn values."]},"id_namespaces":{"entity":"group id","member":"fa_protein","gene":"fa_locus"},"mapping":{"method":"Synthetic table with planted multi-gene and unmapped groups.","entities_total":120,"entities_mapped":117,"entities_partial":0,"entities_unmapped":3,"entities_multi_gene":6,"members_total":132,"members_mapped":129,"genes_total":129,"unmapped_entities":["grp-0010","grp-0050","grp-0090"],"multi_gene_entities":["grp-0004","grp-0024","grp-0044","grp-0064","grp-0084","grp-0104"],"source":"synthetic"},"distribution":{"status":"public","reason":"Synthetic, CC0."},"synthetic":true},"compartments":[{"id":"GO:9000001","label":"Cortex","ontology_id":"GO:9000001"},{"id":"GO:9000002","label":"Vacuole","ontology_id":"GO:9000002"},{"id":"GO:9000003","label":"Plastid","ontology_id":"GO:9000003"},{"id":"GO:9000004","label":"Nucleolus","ontology_id":"GO:9000004"},{"id":"GO:9000005","label":"Cell wall","ontology_id":"GO:9000005"},{"id":"GO:9000006","label":"Lipid droplet","ontology_id":"GO:9000006"}],"fractions":[{"id":"mild-1","label":"mild 1","condition":"mild"},{"id":"mild-2","label":"mild 2","condition":"mild"},{"id":"mild-3","label":"mild 3","condition":"mild"},{"id":"mild-4","label":"mild 4","condition":"mild"},{"id":"mild-5","label":"mild 5","condition":"mild"},{"id":"harsh-1","label":"harsh 1","condition":"harsh"},{"id":"harsh-2","label":"harsh 2","condition":"harsh"},{"id":"harsh-3","label":"harsh 3","condition":"harsh"},{"id":"harsh-4","label":"harsh 4","condition":"harsh"},{"id":"harsh-5","label":"harsh 5","condition":"harsh"}],"entities":[{"id":"grp-0001","label":"FaP1","members":[{"id":"fa|prot-0001.a","gene":"locus:FA_0001","description":"synthetic protein 1"}]},{"id":"grp-0002","label":"FaP2","members":[{"id":"fa|prot-0002.a","gene":"locus:FA_0002","description":"synthetic protein 2"}]},{"id":"grp-0003","label":"FaP3","members":[{"id":"fa|prot-0003.a","gene":"locus:FA_0003","description":"synthetic protein 3"}]},{"id":"grp-0004","label":"FaP4","members":[{"id":"fa|prot-0004.a","gene":"locus:FA_0004","description":"synthetic protein 4"},{"id":"fa|prot-0504.a","gene":"locus:FA_0504"},{"id":"fa|prot-0704.a","gene":"locus:FA_0704"}]},{"id":"grp-0005","label":"FaP5","members":[{"id":"fa|prot-0005.a","gene":"locus:FA_0005","description":"synthetic protein 5"}]},{"id":"grp-0006","label":"FaP6","members":[{"id":"fa|prot-0006.a","gene":"locus:FA_0006","description":"synthetic protein 6"}]},{"id":"grp-0007","label":"FaP7","members":[{"id":"fa|prot-0007.a","gene":"locus:FA_0007","description":"synthetic protein 7"}]},{"id":"grp-0008","label":"FaP8","members":[{"id":"fa|prot-0008.a","gene":"locus:FA_0008","description":"synthetic protein 8"}]},{"id":"grp-0009","label":"FaP9","members":[{"id":"fa|prot-0009.a","gene":"locus:FA_0009","description":"synthetic protein 9"}]},{"id":"grp-0010","label":"FaP10","members":[{"id":"fa|orf-0010","gene":null}]},{"id":"grp-0011","label":"FaP11","members":[{"id":"fa|prot-0011.a","gene":"locus:FA_0011","description":"synthetic protein 11"}]},{"id":"grp-0012","label":"FaP12","members":[{"id":"fa|prot-0012.a","gene":"locus:FA_0012","description":"synthetic protein 12"}]},{"id":"grp-0013","label":"FaP13","members":[{"id":"fa|prot-0013.a","gene":"locus:FA_0013","description":"synthetic protein 13"}]},{"id":"grp-0014","label":"FaP14","members":[{"id":"fa|prot-0014.a","gene":"locus:FA_0014","description":"synthetic protein 14"}]},{"id":"grp-0015","label":"FaP15","members":[{"id":"fa|prot-0015.a","gene":"locus:FA_0015","description":"synthetic protein 15"}]},{"id":"grp-0016","label":"FaP16","members":[{"id":"fa|prot-0016.a","gene":"locus:FA_0016","description":"synthetic protein 16"}]},{"id":"grp-0017","label":"FaP17","members":[{"id":"fa|prot-0017.a","gene":"locus:FA_0017","description":"synthetic protein 17"}]},{"id":"grp-0018","label":"FaP18","members":[{"id":"fa|prot-0018.a","gene":"locus:FA_0018","description":"synthetic protein 18"}]},{"id":"grp-0019","label":"FaP19","members":[{"id":"fa|prot-0019.a","gene":"locus:FA_0019","description":"synthetic protein 19"}]},{"id":"grp-0020","label":"FaP20","members":[{"id":"fa|prot-0020.a","gene":"locus:FA_0020","description":"synthetic protein 20"}]},{"id":"grp-0021","label":"FaP21","members":[{"id":"fa|prot-0021.a","gene":"locus:FA_0021","description":"synthetic protein 21"}]},{"id":"grp-0022","label":"FaP22","members":[{"id":"fa|prot-0022.a","gene":"locus:FA_0022","description":"synthetic protein 22"}]},{"id":"grp-0023","label":"FaP23","members":[{"id":"fa|prot-0023.a","gene":"locus:FA_0023","description":"synthetic protein 23"}]},{"id":"grp-0024","label":"FaP24","members":[{"id":"fa|prot-0024.a","gene":"locus:FA_0024","description":"synthetic protein 24"},{"id":"fa|prot-0524.a","gene":"locus:FA_0524"},{"id":"fa|prot-0724.a","gene":"locus:FA_0724"}]},{"id":"grp-0025","label":"FaP25","members":[{"id":"fa|prot-0025.a","gene":"locus:FA_0025","description":"synthetic protein 25"}]},{"id":"grp-0026","label":"FaP26","members":[{"id":"fa|prot-0026.a","gene":"locus:FA_0026","description":"synthetic protein 26"}]},{"id":"grp-0027","label":"FaP27","members":[{"id":"fa|prot-0027.a","gene":"locus:FA_0027","description":"synthetic protein 27"}]},{"id":"grp-0028","label":"FaP28","members":[{"id":"fa|prot-0028.a","gene":"locus:FA_0028","description":"synthetic protein 28"}]},{"id":"grp-0029","label":"FaP29","members":[{"id":"fa|prot-0029.a","gene":"locus:FA_0029","description":"synthetic protein 29"}]},{"id":"grp-0030","label":"FaP30","members":[{"id":"fa|prot-0030.a","gene":"locus:FA_0030","description":"synthetic protein 30"}]},{"id":"grp-0031","label":"FaP31","members":[{"id":"fa|prot-0031.a","gene":"locus:FA_0031","description":"synthetic protein 31"}]},{"id":"grp-0032","label":"FaP32","members":[{"id":"fa|prot-0032.a","gene":"locus:FA_0032","description":"synthetic protein 32"}]},{"id":"grp-0033","label":"FaP33","members":[{"id":"fa|prot-0033.a","gene":"locus:FA_0033","description":"synthetic protein 33"}]},{"id":"grp-0034","label":"FaP34","members":[{"id":"fa|prot-0034.a","gene":"locus:FA_0034","description":"synthetic protein 34"}]},{"id":"grp-0035","label":"FaP35","members":[{"id":"fa|prot-0035.a","gene":"locus:FA_0035","description":"synthetic protein 35"}]},{"id":"grp-0036","label":"FaP36","members":[{"id":"fa|prot-0036.a","gene":"locus:FA_0036","description":"synthetic protein 36"}]},{"id":"grp-0037","label":"FaP37","members":[{"id":"fa|prot-0037.a","gene":"locus:FA_0037","description":"synthetic protein 37"}]},{"id":"grp-0038","label":"FaP38","members":[{"id":"fa|prot-0038.a","gene":"locus:FA_0038","description":"synthetic protein 38"}]},{"id":"grp-0039","label":"FaP39","members":[{"id":"fa|prot-0039.a","gene":"locus:FA_0039","description":"synthetic protein 39"}]},{"id":"grp-0040","label":"FaP40","members":[{"id":"fa|prot-0040.a","gene":"locus:FA_0040","description":"synthetic protein 40"}]},{"id":"grp-0041","label":"FaP41","members":[{"id":"fa|prot-0041.a","gene":"locus:FA_0041","description":"synthetic protein 41"}]},{"id":"grp-0042","label":"FaP42","members":[{"id":"fa|prot-0042.a","gene":"locus:FA_0042","description":"synthetic protein 42"}]},{"id":"grp-0043","label":"FaP43","members":[{"id":"fa|prot-0043.a","gene":"locus:FA_0043","description":"synthetic protein 43"}]},{"id":"grp-0044","label":"FaP44","members":[{"id":"fa|prot-0044.a","gene":"locus:FA_0044","description":"synthetic protein 44"},{"id":"fa|prot-0544.a","gene":"locus:FA_0544"},{"id":"fa|prot-0744.a","gene":"locus:FA_0744"}]},{"id":"grp-0045","label":"FaP45","members":[{"id":"fa|prot-0045.a","gene":"locus:FA_0045","description":"synthetic protein 45"}]},{"id":"grp-0046","label":"FaP46","members":[{"id":"fa|prot-0046.a","gene":"locus:FA_0046","description":"synthetic protein 46"}]},{"id":"grp-0047","label":"FaP47","members":[{"id":"fa|prot-0047.a","gene":"locus:FA_0047","description":"synthetic protein 47"}]},{"id":"grp-0048","label":"FaP48","members":[{"id":"fa|prot-0048.a","gene":"locus:FA_0048","description":"synthetic protein 48"}]},{"id":"grp-0049","label":"FaP49","members":[{"id":"fa|prot-0049.a","gene":"locus:FA_0049","description":"synthetic protein 49"}]},{"id":"grp-0050","label":"FaP50","members":[{"id":"fa|orf-0050","gene":null}]},{"id":"grp-0051","label":"FaP51","members":[{"id":"fa|prot-0051.a","gene":"locus:FA_0051","description":"synthetic protein 51"}]},{"id":"grp-0052","label":"FaP52","members":[{"id":"fa|prot-0052.a","gene":"locus:FA_0052","description":"synthetic protein 52"}]},{"id":"grp-0053","label":"FaP53","members":[{"id":"fa|prot-0053.a","gene":"locus:FA_0053","description":"synthetic protein 53"}]},{"id":"grp-0054","label":"FaP54","members":[{"id":"fa|prot-0054.a","gene":"locus:FA_0054","description":"synthetic protein 54"}]},{"id":"grp-0055","label":"FaP55","members":[{"id":"fa|prot-0055.a","gene":"locus:FA_0055","description":"synthetic protein 55"}]},{"id":"grp-0056","label":"FaP56","members":[{"id":"fa|prot-0056.a","gene":"locus:FA_0056","description":"synthetic protein 56"}]},{"id":"grp-0057","label":"FaP57","members":[{"id